{
  "$schema": "./questionnaire-definition.schema.json",
  "schemaVersion": 1,
  "id": "system-usability-scale",
  "version": "brooke-1996",
  "name": "System Usability Scale",
  "shortName": "SUS",
  "description": "The ten-item System Usability Scale with its standard five-point agreement response scale and scoring rule.",
  "introPrompt": "Think about the system that you have just used and indicate how strongly you agree or disagree with each statement.",
  "officialContentNotice": "The ten SUS statements, five response values and alternating scoring rule remain unchanged.",
  "source": {
    "label": "Brooke, J. (1996), SUS: A quick and dirty usability scale",
    "url": "https://digital.ahrq.gov/sites/default/files/docs/survey/systemusabilityscale%2528sus%2529_comp%255B1%255D.pdf"
  },
  "scale": {
    "minimum": 1,
    "maximum": 5,
    "step": 1
  },
  "items": [
    {
      "id": "sus01",
      "name": "Item 1",
      "prompt": "I think that I would like to use this system frequently.",
      "shortMeaning": "Agreement with item 1.",
      "lowAnchor": "Strongly disagree",
      "highAnchor": "Strongly agree"
    },
    {
      "id": "sus02",
      "name": "Item 2",
      "prompt": "I found the system unnecessarily complex.",
      "shortMeaning": "Agreement with item 2.",
      "lowAnchor": "Strongly disagree",
      "highAnchor": "Strongly agree"
    },
    {
      "id": "sus03",
      "name": "Item 3",
      "prompt": "I thought the system was easy to use.",
      "shortMeaning": "Agreement with item 3.",
      "lowAnchor": "Strongly disagree",
      "highAnchor": "Strongly agree"
    },
    {
      "id": "sus04",
      "name": "Item 4",
      "prompt": "I think that I would need the support of a technical person to be able to use this system.",
      "shortMeaning": "Agreement with item 4.",
      "lowAnchor": "Strongly disagree",
      "highAnchor": "Strongly agree"
    },
    {
      "id": "sus05",
      "name": "Item 5",
      "prompt": "I found the various functions in this system were well integrated.",
      "shortMeaning": "Agreement with item 5.",
      "lowAnchor": "Strongly disagree",
      "highAnchor": "Strongly agree"
    },
    {
      "id": "sus06",
      "name": "Item 6",
      "prompt": "I thought there was too much inconsistency in this system.",
      "shortMeaning": "Agreement with item 6.",
      "lowAnchor": "Strongly disagree",
      "highAnchor": "Strongly agree"
    },
    {
      "id": "sus07",
      "name": "Item 7",
      "prompt": "I would imagine that most people would learn to use this system very quickly.",
      "shortMeaning": "Agreement with item 7.",
      "lowAnchor": "Strongly disagree",
      "highAnchor": "Strongly agree"
    },
    {
      "id": "sus08",
      "name": "Item 8",
      "prompt": "I found the system very cumbersome to use.",
      "shortMeaning": "Agreement with item 8.",
      "lowAnchor": "Strongly disagree",
      "highAnchor": "Strongly agree"
    },
    {
      "id": "sus09",
      "name": "Item 9",
      "prompt": "I felt very confident using the system.",
      "shortMeaning": "Agreement with item 9.",
      "lowAnchor": "Strongly disagree",
      "highAnchor": "Strongly agree"
    },
    {
      "id": "sus10",
      "name": "Item 10",
      "prompt": "I needed to learn a lot of things before I could get going with this system.",
      "shortMeaning": "Agreement with item 10.",
      "lowAnchor": "Strongly disagree",
      "highAnchor": "Strongly agree"
    }
  ],
  "scoring": {
    "strategy": "sus-standard-v1",
    "scoreName": "SUS score",
    "minimum": 0,
    "maximum": 100
  },
  "supports": {
    "simplerExplanations": false,
    "smileyLandmarks": false
  }
}
