{
  "$schema": "./questionnaire-definition.schema.json",
  "schemaVersion": 1,
  "id": "nasa-tlx-weighted",
  "version": "1.0.0",
  "name": "NASA Task Load Index",
  "shortName": "NASA-TLX",
  "description": "Full weighted NASA-TLX with six magnitude ratings and fifteen pairwise source-of-workload comparisons.",
  "introPrompt": "Think about the task that you have just completed.",
  "officialContentNotice": "The official NASA-TLX dimensions, values, direction and scoring remain authoritative.",
  "source": {
    "label": "NASA Human Systems Integration Division, NASA Task Load Index",
    "url": "https://www.nasa.gov/human-systems-integration-division/nasa-task-load-index-tlx/"
  },
  "scale": {
    "minimum": 0,
    "maximum": 100,
    "step": 5
  },
  "items": [
    {
      "id": "mental",
      "name": "Mental Demand",
      "prompt": "How much mental and perceptual activity was required (for example, thinking, deciding, calculating, remembering, looking or searching)? Was the task easy or demanding, simple or complex, exacting or forgiving?",
      "simpleExplanation": "Think about how much concentration, remembering, deciding, calculating or noticing the task required.",
      "shortMeaning": "Thinking, deciding, remembering or concentrating.",
      "lowAnchor": "Low",
      "highAnchor": "High",
      "voiceLowAliases": ["low", "lo"],
      "voiceHighAliases": ["high", "hi"]
    },
    {
      "id": "physical",
      "name": "Physical Demand",
      "prompt": "How much physical activity was required (for example, pushing, pulling, turning, controlling or activating)? Was the task easy or demanding, slow or brisk, slack or strenuous, restful or laborious?",
      "simpleExplanation": "Think about how much physical movement, control or force the task required.",
      "shortMeaning": "Movement, control or physical force.",
      "lowAnchor": "Low",
      "highAnchor": "High",
      "voiceLowAliases": ["low", "lo"],
      "voiceHighAliases": ["high", "hi"]
    },
    {
      "id": "temporal",
      "name": "Temporal Demand",
      "prompt": "How much time pressure did you feel due to the rate or pace at which the task or task elements occurred? Was the pace slow and leisurely or rapid and frantic?",
      "simpleExplanation": "Think about pressure caused by the pace or speed of the task. This is about feeling rushed, not simply how long the task lasted.",
      "shortMeaning": "Time pressure caused by the pace of the task.",
      "lowAnchor": "Low",
      "highAnchor": "High",
      "voiceLowAliases": ["low", "lo"],
      "voiceHighAliases": ["high", "hi"]
    },
    {
      "id": "performance",
      "name": "Performance",
      "prompt": "How successful do you think you were in accomplishing the goals of the task set by the experimenter or yourself? How satisfied were you with your performance in accomplishing these goals?",
      "simpleExplanation": "Think about how successfully you completed the task and how satisfied you were with the result. On this scale, Good is on the left and Poor is on the right.",
      "shortMeaning": "How successful and satisfied you were with your result.",
      "lowAnchor": "Good",
      "highAnchor": "Poor",
      "voiceLowAliases": ["good", "successful"],
      "voiceHighAliases": ["poor", "pour", "bad", "unsuccessful"]
    },
    {
      "id": "effort",
      "name": "Effort",
      "prompt": "How hard did you have to work mentally and physically to accomplish your level of performance?",
      "simpleExplanation": "Think about how hard you had to work, mentally and physically, to achieve your result. This is the work you put in, rather than the demands of the task itself.",
      "shortMeaning": "How hard you had to work to achieve your result.",
      "lowAnchor": "Low",
      "highAnchor": "High",
      "voiceLowAliases": ["low", "lo"],
      "voiceHighAliases": ["high", "hi"]
    },
    {
      "id": "frustration",
      "name": "Frustration",
      "prompt": "How insecure, discouraged, irritated, stressed and annoyed versus secure, gratified, content, relaxed and complacent did you feel during the task?",
      "simpleExplanation": "Think about how stressed, irritated or discouraged you felt, compared with feeling secure, content and relaxed.",
      "shortMeaning": "Feeling stressed, irritated or discouraged.",
      "lowAnchor": "Low",
      "highAnchor": "High",
      "voiceLowAliases": ["low", "lo"],
      "voiceHighAliases": ["high", "hi"]
    }
  ],
  "landmarks": [
    { "value": 0, "cue": "😀", "position": "low" },
    { "value": 25, "cue": "🙂", "position": "closer-low" },
    { "value": 50, "cue": "😐", "position": "middle" },
    { "value": 75, "cue": "🙁", "position": "closer-high" },
    { "value": 100, "cue": "☹️", "position": "high" }
  ],
  "pairwise": {
    "mode": "all-pairs",
    "prompt": "Which factor contributed more to the workload you experienced?",
    "instruction": "This is not a Low-to-High rating. Choose the factor that was the more important source of workload in the task.",
    "simplePrompt": "Which one added more to the work you had to do?"
  },
  "scoring": {
    "strategy": "nasa-tlx-weighted-v1",
    "scoreName": "Weighted workload score",
    "minimum": 0,
    "maximum": 100
  },
  "supports": {
    "simplerExplanations": true,
    "smileyLandmarks": true
  }
}
